"Track URI","Track Name","Artist URI","Artist Name","Album URI","Album Name","Album Release Date","Disc Number","Track Number","Track Duration (ms)","Explicit","Popularity","Added By","Added At"
"spotify:track:7CIoJE0JfVFcmmUY3fFojH","Hungarian Rhapsody No. 2 in C-Sharp Minor, S. 244/2","spotify:artist:1385hLNbrnbCJGokfH2ac2, spotify:artist:4Ws5hSoABAwvGJ4LhHwHgq","Franz Liszt, Vladimir Horowitz","spotify:album:3YyrjIgvaPyq26kuPP2zzG","Horowitz Plays Liszt","1930","3","2","541600","false","49","spotify:user:sebastianelisapfeifer","2017-10-30T21:49:03Z"
"spotify:track:3WXihZyREYjtzDjTfArJN2","Hungarian Dance No.5 In G Minor, WoO 1 No. 5","spotify:artist:5wTAi7QkpP6kp8a54lmTOq, spotify:artist:003f4bk13c6Q3gAUXv7dGJ, spotify:artist:6HclTVD03WSY6GUpN16BkP","Johannes Brahms, Wiener Philharmoniker, Claudio Abbado","spotify:album:1vpzk5Cb8g5MTzxZvio1pi","Brahms: 21 Hungarian Dances","1984-01-01","1","5","138706","false","0","spotify:user:sebastianelisapfeifer","2017-10-30T21:49:21Z"
"spotify:track:1QGN2Perfetpju3762mJsk","Für Elise, WoO 59","spotify:artist:2wOqMjp9TyABvtHdOSOTUS, spotify:artist:6hpRhyx59f3xKAAQayjuCR","Ludwig van Beethoven, Nelly Kokinos","spotify:album:65OwxsoVvJztqS3wSCyGlL","Beethoven Greatest Hits","1991-11-09","1","4","188466","false","0","spotify:user:sebastianelisapfeifer","2017-10-30T21:49:39Z"
"spotify:track:6nkyCZZDT2rmTJcJSJiOGi","Canon in D","spotify:artist:62TD7509VQIxUe4WpwO0s3, spotify:artist:51RiZjPgKKJ1uDsZVmntmF, spotify:artist:2nhApVkD1mcbeH3ubJHiGg","Johann Pachelbel, Stuttgart Chamber Orchestra, Karl Münchinger","spotify:album:7yQ3jgoi8fLV4RnD83cqzo","Pachelbel - Canon in D and Beyond","2014-09-12","1","1","269693","false","0","spotify:user:sebastianelisapfeifer","2017-10-30T21:51:13Z"
"spotify:track:4GRDiNU8fkizXz4rDX9gS5","Serenade In G Major: Eine Kleine Nachtmusik, K. 525: I. Allegro","spotify:artist:4NJhFmfw43RLBLjQvxDuRS, spotify:artist:2Oz3z7PPQUMU2KNYgcO1sA, spotify:artist:0MPbAeGQj0YatrUMdY2KEr","Wolfgang Amadeus Mozart, The English Concert, Andrew Manze","spotify:album:0H1e6MSky4K9zx1mruBmTO","Mozart: Night Music","2003","1","1","468133","false","54","spotify:user:sebastianelisapfeifer","2017-10-30T21:51:39Z"
"spotify:track:6JV3m7TDJ9gsJNHp0e4MWM","Vivaldi: Violin Concerto in E Major, RV 269, No. 1, Spring: I. Allegro","spotify:artist:2QOIawHpSlOwXDvSqQ9YJR, spotify:artist:7AANfmLM36QqH6QsOQnV3h, spotify:artist:2DO4p3CPDnInsJfg0jFfaF","Antonio Vivaldi, Nigel Kennedy, English Chamber Orchestra","spotify:album:7nXsdgfAlJjRBBP6J0ehw2","Vivaldi: The Four Seasons","1989","1","1","187720","false","59","spotify:user:sebastianelisapfeifer","2017-10-30T21:52:39Z"
"spotify:track:2cq1Bvya0v5sC0FioZiiD3","Concerto for 2 Cellos in G Minor, RV 531: I. Allegro","spotify:artist:2QOIawHpSlOwXDvSqQ9YJR, spotify:artist:1U4pv151m4SgVMg8fXROYp, spotify:artist:4UxVKRFFn96O4m2VDkoXSw, spotify:artist:16QiQnPIen1llsJLqQKyxR, spotify:artist:0EFuR1ucytxvaPypD1sXxL","Antonio Vivaldi, Julian Lloyd Webber, Jiaxin Lloyd Webber, European Union Chamber Orchestra, Hanspeter Hofmann","spotify:album:7IGpz1SC0t2GXI3C5vXKc2","Vivaldi: Concertos for 2 Cellos","2014-10-07","1","4","210560","false","39","spotify:user:sebastianelisapfeifer","2017-10-30T21:56:22Z"
"spotify:track:3SRqUYfMhO2V7d8XJHrfP8","Má Vlast, JB 1:112: No. 2, Die Moldau","spotify:artist:25Eab1kIY1gh0Yo1oV04G4, spotify:artist:0SlNRZ8zBLAgyB1lsoYxAa, spotify:artist:5tQs2q4OYuqqHL2a5u4B61","Bedřich Smetana, Gewandhausorchester Leipzig, Václav Neumann","spotify:album:4v86L3dyk7QaLFQUx5xMjA","Smetana: Mein Vaterland (KulturSpiegel - Eterna - Über Grenzen Hinaus)","1968","1","2","768640","false","30","spotify:user:sebastianelisapfeifer","2017-11-01T12:26:06Z"
"spotify:track:2xizRhme7pYeITbH1NLLGt","Tchaikovsky: Swan Lake, Op. 20, Act 2: No. 10, Scène (Moderato)","spotify:artist:3MKCzCnpzw3TjUYs2v7vDA, spotify:artist:2tfWguHr2nj4e8KXLKciVq, spotify:artist:5yxyJsFanEAuwSM5kOuZKc","Pyotr Ilyich Tchaikovsky, André Previn, London Symphony Orchestra","spotify:album:7dVA06E7AP7P7VzPyNxQVO","Tchaikovsky: Swan Lake","1976","1","10","166866","false","65","spotify:user:sebastianelisapfeifer","2017-11-04T11:03:05Z"
"spotify:track:53Z3s7DPc7WbkYt9L9ZdlJ","Strauss I: Radetzky March, Op. 228","spotify:artist:4WMHJgeJCssiGW3ssUT7eb, spotify:artist:4L1KSucx7LN4DyRT1w4z9S, spotify:artist:0KE7MPlNGYZugOqQngcqQV","Johann Strauss I, Wiener Johann Strauss Orchester, Willi Boskovsky","spotify:album:4DGkGu1clbRRVGRN3TdkUj","The Strausses of Vienna","1989-10-16","1","1","172506","false","34","spotify:user:sebastianelisapfeifer","2017-11-04T11:03:18Z"
"spotify:track:0VQMAup2VdeQWLCvM14Uz2","The Four Seasons, Violin Concerto No. 2 in G Minor, RV 315 ""L'estate"": III. Tempo impetuoso d'estate","spotify:artist:2QOIawHpSlOwXDvSqQ9YJR, spotify:artist:2U5grycWMciHdeNQGUH7dO, spotify:artist:3r1dphXjVBOwbUAYrrkEkQ","Antonio Vivaldi, Europa Galante, Fabio Biondi","spotify:album:0kSdjU9M28uPSo1bdnqwna","Vivaldi: The Four Seasons","1999-12-30","1","6","150666","false","53","spotify:user:sebastianelisapfeifer","2017-11-04T11:05:18Z"
"spotify:track:5MpayeDmtJwgCpxQOkVBtN","Rigoletto / Act 3: ""La donna è mobile""","spotify:artist:0Y8KmFkKOgJybpVobn1onU, spotify:artist:5yxyJsFanEAuwSM5kOuZKc, spotify:artist:6JAPOSeaWl61UBRKZYgAeZ","Luciano Pavarotti, London Symphony Orchestra, Richard Bonynge","spotify:album:24T24Dge7QgHI3gKHHfKAw","Pavarotti's Greatest Hits","1980-01-01","2","1","146000","false","47","spotify:user:sebastianelisapfeifer","2017-11-04T11:05:40Z"
"spotify:track:5ib9giBSAv5Mcgr25qZtra","Peer Gynt Suite No. 1, Op. 46: I. Morning Mood","spotify:artist:5ihY290YPGc3aY2xTyx7Gy, spotify:artist:003f4bk13c6Q3gAUXv7dGJ, spotify:artist:3FEd0qHPFOgcpfw7bCXB4x","Edvard Grieg, Wiener Philharmoniker, Zubin Mehta","spotify:album:0kLLFKLyqRhUzW4pnSIREb","Sommernachtskonzert 2015 / Summer Night Concert 2015","2015-05-29","1","7","232880","false","45","spotify:user:sebastianelisapfeifer","2017-11-04T11:06:12Z"
"spotify:track:67ZR9Wg2M85maAMFIxLZ4E","II. Dance of the Sugar Plum Fairy","spotify:artist:3MKCzCnpzw3TjUYs2v7vDA, spotify:artist:07Nqz7k5QdR10iuTJkd6Mp","Pyotr Ilyich Tchaikovsky, Olga Scheps","spotify:album:6XbV0wF0MogJ5HJqjqJu8D","Super-Hits der Klassik, Vol. 3","2017-11-03","1","3","109933","false","0","spotify:user:sebastianelisapfeifer","2017-11-04T11:06:50Z"
"spotify:track:3klpOEWNVWcvWdZ4r7NOAW","Greensleeves - Arranged By Catrin Finch","spotify:artist:1U5zgr455OGyIkLNXvDdrf, spotify:artist:5YHCN15OUsjGAg1az5m818, spotify:artist:0DzNsDmiGIAXQxbXQs4JCG","Traditional, Catrin Finch, Hannah Stone","spotify:album:6nQYYHsISTqIkNEWTVNqSF","Nachtmusik - zum Entspannen und Genießen","2017-08-11","1","19","161520","false","0","spotify:user:sebastianelisapfeifer","2017-11-04T11:08:43Z"
"spotify:track:3C4JNyv2NAT72xm0cDKl0v","The Nutcracker, Op. 71: Act II Tableau 3: Variation 2: Dance of the Sugar-Plum Fairy","spotify:artist:3MKCzCnpzw3TjUYs2v7vDA, spotify:artist:1W3sZMluDmealiI6B5awE9, spotify:artist:2YdRnOqBXCl9g8xCLcGh8C","Pyotr Ilyich Tchaikovsky, Russian National Orchestra, Mikhail Pletnev","spotify:album:6g8mVkQHQOEczebvw6egrR","Tchaikovsky: The Nutcracker","2011-09-06","2","12","141373","false","52","spotify:user:sebastianelisapfeifer","2017-11-04T12:44:11Z"
"spotify:track:4fsaAp9hGI69t7gJ2TsLse","Mozart - Turkish March","spotify:artist:1JWmvf1WcrLZW5kYJGDvMv","Entspannungsmusik Meer","spotify:album:4Ov4Pc0nOPKRUt6fbHoFaZ","Ballet Music for Children and Kids - Classical Dance Music for Children Ballet, Dance Schools, Dance Lessons, Dance Classes, Ballet Positions, Ballet Moves and Ballet Dance Steps 100% Music for Ballet Class","2010-09-15","1","5","89041","false","38","spotify:user:sebastianelisapfeifer","2017-11-12T23:00:44Z"
"spotify:track:01wVEqDPRhm9ASroEaOe1C","Suiten für Violoncello solo in G-Dur, BWV 1007: I. Praeludium","spotify:artist:7EJNkcaXhu5vsQs8eUQLIJ","Olga Holding","spotify:album:6riM1CbWAS1TEUaDYyOny5","Klassische Studienmusik, Vol. 3 (Eine entspannende Auswahl von Bach, Beethoven, Mozart, Satie, Debussy und Tschaikowski)","2015-04-23","1","8","136580","false","26","spotify:user:sebastianelisapfeifer","2017-11-12T23:02:10Z"
"spotify:track:76YLWd4lxn2oCDb71uV9xy","Op.314: An der schoenen blauen Donau-Walzer","spotify:artist:5goS0v24Fc1ydjCKQRwtjM, spotify:artist:058Y9LnHNkJEnH36W12Bwl, spotify:artist:05QyhgGCPd7XYunJiOceKX","Johann Strauss II, Vienna Volksoper Orchestra, A. Schol","spotify:album:3wV8zBz2BdbLFrF8modB3D","Walzer - Best of Waltzes and Polkas","1990","1","5","600920","false","0","spotify:user:sebastianelisapfeifer","2017-11-12T23:02:31Z"
"spotify:track:6a94T6J00LtMVPAQw4gt0r","Tchaikovsky: Overture with Military Band, Op. 49, ""1812 Overture""","spotify:artist:3MKCzCnpzw3TjUYs2v7vDA, spotify:artist:5cp6B8bMNsXdQKgE6exdzx, spotify:artist:0IuqAyi5CMgpuyhckrcqNs","Pyotr Ilyich Tchaikovsky, Oslo Philharmonic Orchestra, Mariss Jansons","spotify:album:5PXQYvZxbx5JqsdUPmPrKD","The Classic Experience","1988","2","8","215133","false","29","spotify:user:sebastianelisapfeifer","2017-11-12T23:02:54Z"
"spotify:track:4v3o4IJt1VRDNiM2LCoOXV","Symphony No.5 In C Minor, Op.67: 1. Allegro con brio","spotify:artist:2wOqMjp9TyABvtHdOSOTUS, spotify:artist:003f4bk13c6Q3gAUXv7dGJ, spotify:artist:6aL4ovuNuBg7rmrPjOTIUN","Ludwig van Beethoven, Wiener Philharmoniker, Carlos Kleiber","spotify:album:2aNAica8UZ1gPub5p1UYUe","Beethoven: Symphonies Nos.5 & 7","1995-01-01","1","1","442000","false","0","spotify:user:sebastianelisapfeifer","2017-11-12T23:03:13Z"
"spotify:track:5MrYNXb5USRnSfDYrKADhF","The Four Seasons, Op. 8 - Concerto No. 2 in G Minor, RV 315, ""Summer"": III. Presto: Tempo impettuoso d'Estate","spotify:artist:51RiZjPgKKJ1uDsZVmntmF, spotify:artist:0RkCYrO4cNyWVkWeRBFco7","Stuttgart Chamber Orchestra, Rainer Kussmaul","spotify:album:4i2zqFJIV3bApikgttFWWr","Vivaldi: Le Quattro Stagioni, Alla Rustica, Al Santo Sepolcro, l'Estro Armonico","2010-12-14","1","6","157992","false","22","spotify:user:sebastianelisapfeifer","2017-11-12T23:03:34Z"
"spotify:track:7DTp0wFpktphrM7vDnPCs1","The Four Seasons","spotify:artist:51RiZjPgKKJ1uDsZVmntmF, spotify:artist:3nqDuDR1Z08qQzHU7QLrVG","Stuttgart Chamber Orchestra, Martin Sieghart","spotify:album:3EvjhreyDz2ks1LgZCy0Lu","Ultimate Wedding Collection: Ceremony","2010-03-16","1","17","193464","false","12","spotify:user:sebastianelisapfeifer","2017-11-12T23:04:21Z"
"spotify:track:5zhuWncJsBKrQ1HhmAKNAg","Peer Gynt, Op. 23: IV. In the Hall of the Mountain King","spotify:artist:5ihY290YPGc3aY2xTyx7Gy, spotify:artist:1Q9HCWdqbiui9pOsDtYkXW, spotify:artist:09KZU0NsS7jRa5p0SflmGY","Edvard Grieg, Andrew Davis, Philharmonia Orchestra","spotify:album:2Lqna5CKbzGVWIdVI3Yext","Fright Night: Music That Goes Bump in the Night","1961","1","3","144733","false","58","spotify:user:sebastianelisapfeifer","2018-01-11T17:04:16Z"
"spotify:track:5XpAlFFuuBh6lIuVZ2Vhn0","Toccata and Fugue in D minor, BWV 565","spotify:artist:5aIqB5nVVvmFsvSdExz408, spotify:artist:7Fu8GId2mQkNzqDbZbcDWM","Johann Sebastian Bach, Ton Koopman","spotify:album:3QcYPj3LaZO99KGsnXiNAh","Bach, J.S.: Toccatas & Fugues BWV 538; BWV 540; BWV 564; BWV 565","1984-01-01","1","1","482066","false","0","spotify:user:sebastianelisapfeifer","2018-01-22T12:33:19Z"
"spotify:track:0umpvSQjb6ewjc70PRp8Nt","Davy Jones (From ""Pirates of the Caribbean: Dead Man's Chest"")","spotify:artist:2oQJQUIpJFFnfKvHJA0xBu","The City of Prague Philharmonic Orchestra","spotify:album:3TsTnfvHHqrTsVBn4PeIm3","The Music of Hans Zimmer: The Definitive Collection","2014-07-28","2","14","204026","false","30","spotify:user:sebastianelisapfeifer","2018-06-08T11:55:15Z"
"spotify:track:1ntwYN2nT0Dl3c8lne15ii","Can Can","spotify:artist:4OihBPCQzR4GfbzqOY69Xm, spotify:artist:7AwZZVVAZn2ZtqKqb0iiDp","Jacques Offenbach, Helmuth Brandenburg","spotify:album:7rp3rdsFu7mapVKxg8f7Eg","Operas Operetta Overtures, Operetten Opern Ouvertüren","2010-03-01","1","6","131599","false","53","spotify:user:sebastianelisapfeifer","2018-07-04T08:10:03Z"
"spotify:track:69RoAhDqFOiQb2pQvb24Ii","Requiem: Lacrimosa","spotify:artist:4NJhFmfw43RLBLjQvxDuRS, spotify:artist:0f3PsS9IQ6whvNMFFKnpjl, spotify:artist:0ugRf6ECGBFRCHlv9iG1No","Wolfgang Amadeus Mozart, Choir of King's College\, Cambridge, Stephen Cleobury","spotify:album:373TnwiNUfLYufOpCmi525","Mozart: Requiem Realisations","2013-04-08","1","8","169666","false","0","spotify:user:sebastianelisapfeifer","2018-07-04T08:15:24Z"
"spotify:track:2nnXe7n3Vivs7OfQKRsfWD","Vivaldi: Violin Concerto in G Minor, RV 315 ""L'estate"" (No. 2 from ""Il cimento dell'armonia e dell'inventione"", Op. 8): III. Presto","spotify:artist:2QOIawHpSlOwXDvSqQ9YJR, spotify:artist:7AANfmLM36QqH6QsOQnV3h, spotify:artist:2DO4p3CPDnInsJfg0jFfaF","Antonio Vivaldi, Nigel Kennedy, English Chamber Orchestra","spotify:album:7nXsdgfAlJjRBBP6J0ehw2","Vivaldi: The Four Seasons","1989","1","6","173426","false","61","spotify:user:sebastianelisapfeifer","2018-07-04T08:15:30Z"
"spotify:track:0pjCsB0XNSyqM9UazlTODC","Jazz Suite No. 2: VI. Waltz 2","spotify:artist:6s1pCNXcbdtQJlsnM1hRIA, spotify:artist:0DJZPK3nRWESIS0yexi6Qi, spotify:artist:6jKsnWXyWgE3jyC0Cs0Cdb","Dmitri Shostakovich, Russian State Symphony Orchestra, Dmitry Yablonsky","spotify:album:7K4HfPLJ2JwvXBF02SAiXx","Shostakovich: Jazz Suites Nos. 1 - 2 / The Bolt / Tahiti Trot","2002-04-15","1","14","193600","false","59","spotify:user:sebastianelisapfeifer","2018-07-04T08:21:13Z"
"spotify:track:7HSs4srn1qnZhh7WRWBVOk","Prokofiev: Romeo and Juliet, Op. 64, Act 1: No. 13, Dance of the Knights (Complete Ballet)","spotify:artist:4kHtgiRnpmFIV5Tm4BIs8l, spotify:artist:2tfWguHr2nj4e8KXLKciVq, spotify:artist:5yxyJsFanEAuwSM5kOuZKc","Sergei Prokofiev, André Previn, London Symphony Orchestra","spotify:album:3M5idfqFUxge3skgZQu4R3","Prokofiev: Romeo and Juliet","1973","1","13","341693","false","57","spotify:user:sebastianelisapfeifer","2018-07-04T08:31:32Z"
"spotify:track:17fPXSjZKsuXodj3VMfhCf","Menuet No. 5, Op. 11","spotify:artist:4WpvPj2LlJR8pU4SgKNcum","The Jane Austen Era","spotify:album:3NecPxQtfsaZwpkIGKWTAA","The Jane Austen Era","2009-09-29","1","2","215093","false","40","spotify:user:sebastianelisapfeifer","2018-07-04T08:36:37Z"
"spotify:track:45SmnjVvKJ2OZEo2EScn32","William Tell Overture","spotify:artist:7CIcEIOiWaZcEH35cpsdZq, spotify:artist:2JQBcP1ceEAdwHM6cvSCv8","Boston Pops Orchestra, Arthur Fiedler","spotify:album:74dm3HfyzHTcWyFKrD2vQB","The Only Classical CD/Tape You'll Ever Need!","1991","1","12","184333","false","44","spotify:user:sebastianelisapfeifer","2018-07-04T08:37:37Z"
"spotify:track:7ck1Z4Owr2vLJ1N3gL95rC","Piano Sonata No. 11 in A Major, K. 331: III. Allegretto (Alla Turca)","spotify:artist:4NJhFmfw43RLBLjQvxDuRS, spotify:artist:0xfOM47aJ8EcFX7T6Ugr9W","Wolfgang Amadeus Mozart, Christoph Eschenbach","spotify:album:1SGxNlEud11QufpwEbeiAQ","Mozart, W.A.: Piano Sonatas ""Alla turca""; ""Sonata facile""; Fantasie & Sonata in C minor","1993-01-01","1","11","212200","false","34","spotify:user:sebastianelisapfeifer","2018-07-04T10:55:27Z"
"spotify:track:4KIRPdxc6q5WORsIFRlniK","Suite for Orchestra No.2 in B minor for Flute and Strings, BWV 1067: VIII. Badinerie","spotify:artist:5zB0iVXOwzOkvvpQy2g8al, spotify:artist:6sc5Ikfh41x6bO9IRVvk1u","Philharmonia Slavonica, Henry Adolph","spotify:album:4ukPRG9AdMmbFmGfugUJeI","1-2-3 - A Bach Experience","2011-11-27","1","37","88781","false","23","spotify:user:sebastianelisapfeifer","2018-07-04T11:01:27Z"
"spotify:track:3x8QuJyjUnr38WnSwjVaBn","European Union Hymn Of Europe, ""Come, Sing A Song Of Joy For Peace…""","spotify:artist:428GNN7qZnTsMaK3SfPo6D, spotify:artist:50MREZ0LJcSvrtKuyTV8Su, spotify:artist:0LyfQWJT6nXafLPZqxe9Of","Slovak Radio Symphony Orchestra, Peter Breiner, Various Artists","spotify:album:0U1oPI8TmFBj6Rv7PnAN1p","National Anthems Of The World, Vol. 2: Cambodia - France","1998-02-04","1","36","63040","false","14","spotify:user:sebastianelisapfeifer","2018-07-04T11:03:21Z"
"spotify:track:17i5jLpzndlQhbS4SrTd0B","Cello Suite No. 1 in G Major, BWV 1007: I. Prélude","spotify:artist:5aIqB5nVVvmFsvSdExz408, spotify:artist:5Dl3HXZjG6ZOWT5cV375lk","Johann Sebastian Bach, Yo-Yo Ma","spotify:album:3cvjMNWg7t46NyDZzujfNg","Bach: Cello Suites Nos. 1, 5 & 6","1983","1","1","152280","false","70","spotify:user:sebastianelisapfeifer","2018-07-05T13:14:11Z"
"spotify:track:12hhTyMPivDKLyJDYlwJuX","Eine kleine Nachtmusik, K.525 - Excerpt","spotify:artist:4NJhFmfw43RLBLjQvxDuRS, spotify:artist:003f4bk13c6Q3gAUXv7dGJ, spotify:artist:3fyr5uksidSlLzsUjRIz5A","Wolfgang Amadeus Mozart, Wiener Philharmoniker, Karl Böhm","spotify:album:1716XPsNUeHok477AtTRhX","Best of Classical - Die 50 größten Werke der Klassik","2011-01-01","1","3","214480","false","33","spotify:user:sebastianelisapfeifer","2019-04-16T06:23:29Z"
"spotify:track:4dTUqfrJa0DrBHZ91rpQ7Y","Crimson Tide-Main Theme (From the Score to ""Crimson Tide"")","spotify:artist:4MTfVjZzx72caVcbCjUK73","Dominik Hauser","spotify:album:68XPiEhErLHlUHsYobxqLa","Crimson Tide-Main Theme (From the Score to ""Crimson Tide"")","2014-06-04","1","1","187149","false","26","spotify:user:sebastianelisapfeifer","2019-05-10T20:37:20Z"
"spotify:track:0Ks6BG3vMWyaAaoKu1UcxY","Má Vlast, JB1:112: 2. Vltava - Excerpt","spotify:artist:25Eab1kIY1gh0Yo1oV04G4, spotify:artist:0K23lQ2hSQAlxSEeZ05bjI, spotify:artist:1JlF2VuyOSOasy8ZxCbD6C","Bedřich Smetana, Boston Symphony Orchestra, Rafael Kubelik","spotify:album:7yz8tC65osCKOKnO6hXjk8","100 Meisterwerke der Klassik","2006-01-01","1","15","232653","false","25","spotify:user:sebastianelisapfeifer","2019-05-11T10:18:35Z"
"spotify:track:2jpcucZ7Ap5j2hyQbDEGSn","Laputa: Castle In the Sky Suite","spotify:artist:4iONGlZzuklnaC4vbIHYHu","Eminence Symphony Orchestra","spotify:album:2FyuA1eVjdqOCF2b0MJ0ex","A Night in Fantasia 2009 Live","2009-12-12","1","6","400157","false","47","spotify:user:sebastianelisapfeifer","2019-05-14T17:37:12Z"
"spotify:track:1YQWosTIljIvxAgHWTp7KP","Take Five","spotify:artist:4iRZAbYvBqnxrbs6K25aJ7","The Dave Brubeck Quartet","spotify:album:0nTTEAhCZsbbeplyDMIFuA","Time Out","1959-12-14","1","3","324133","false","67","spotify:user:sebastianelisapfeifer","2019-05-15T09:21:15Z"
"spotify:track:70SwpEllFFiF8JocNuJsq1","Ungarischer Tanz No.5 In G Minor","spotify:artist:5wTAi7QkpP6kp8a54lmTOq, spotify:artist:7DEXpTRYGLyt9dIbMhmkIJ, spotify:artist:1qIRoGEKXINqrCx5N1engi","Johannes Brahms, NDR-Sinfonieorchester, John Eliot Gardiner","spotify:album:7yz8tC65osCKOKnO6hXjk8","100 Meisterwerke der Klassik","2006-01-01","1","14","151013","false","34","spotify:user:sebastianelisapfeifer","2019-05-19T20:14:41Z"
"spotify:track:7oYTWS0BEJcddgKZBkiSJq","Far Over the Misty Mountains Cold","spotify:artist:4d2UfcRE5XSsapO3kyzwdP","Clamavi De Profundis","spotify:album:2b0goUcHfPfYOfUdIdS2NP","Far Over the Misty Mountains Cold (Extended Edition)","2014-07-04","1","1","463439","false","51","spotify:user:sebastianelisapfeifer","2019-05-25T16:37:48Z"
"spotify:track:4V4VuNh68MJzUoGPyyHMa7","Hymn To Red October (Main Title)","spotify:artist:4jF9GaNGCGBeu2nKqFZ1K0","Basil Poledouris","spotify:album:2pKSUtrXA5Vmpir3J0nCMv","The Hunt For Red October","1990-01-01","1","1","306466","false","47","spotify:user:sebastianelisapfeifer","2019-08-16T19:40:11Z"
"spotify:track:5AVTSp5n5ohBqXfwhym3yQ","Kalinka","spotify:artist:493LCoNGji120ALqM6jSo8","Kalinka","spotify:album:659trdwEhvNDpfYuGoHxdN","Somewhere My Love: Russian Gems","2003","1","1","300560","false","19","spotify:user:sebastianelisapfeifer","2019-08-18T14:06:42Z"
"spotify:track:4QRNjHEq1qc8uixaOFOWhF","Tetris Theme - Korobeiniki on Piano","spotify:artist:0tw9OwFgbaPVDCBHYSsUMN","Dagmar Krug","spotify:album:61FpjVVSKHuR1JFMzYgJAB","Tetris Theme - Korobeiniki on Piano","2013-09-08","1","1","115504","false","33","spotify:user:sebastianelisapfeifer","2019-08-18T14:07:10Z"
"spotify:track:0dYaZeUGUgjmRnjyvR1RWg","Symphony No. 3 In A Minor, Op. 56, MWV N 18 - ""Scottish"": 4. Allegro vivacissimo - Allegro maestoso assai","spotify:artist:6MF58APd3YV72Ln2eVg710, spotify:artist:5yxyJsFanEAuwSM5kOuZKc, spotify:artist:5bBulPVoQuw4lzargujOvI","Felix Mendelssohn, London Symphony Orchestra, Peter Maag","spotify:album:1Genq8Wn5i0JHCV0ks3TOe","Mendelssohn: Symphony No.3; A Midsummer Night's Dream","2000-01-01","1","4","576653","false","45","spotify:user:sebastianelisapfeifer","2019-08-18T14:09:40Z"
"spotify:track:3JCPQhJWP7sC4hiv6K0Qk6","Poliushko Polie - Instrumental","spotify:artist:3hJv5p2HwekJysNB2NDnEC, spotify:artist:51HxUAjeZIOv4aniusaDkT","André Rieu, Johann Strauss Orchestra","spotify:album:6ezmXYZNka7DQaMuetuyyr","La Vie Est Belle","2000-01-01","1","14","232440","false","15","spotify:user:sebastianelisapfeifer","2019-08-30T09:43:03Z"
"spotify:track:4YtJdgRW3V4a8W82F0NFk5","Kalinka","spotify:artist:3hJv5p2HwekJysNB2NDnEC, spotify:artist:51HxUAjeZIOv4aniusaDkT","André Rieu, Johann Strauss Orchestra","spotify:album:6ezmXYZNka7DQaMuetuyyr","La Vie Est Belle","2000-01-01","1","6","143293","false","12","spotify:user:sebastianelisapfeifer","2019-08-30T09:48:26Z"
"spotify:track:60TtjskkYuHiyCE3kyXzvq","Lords of Iron","spotify:artist:5GETpZjqNPFTHpVOousGeo","Antti Martikainen","spotify:album:2KaFVQoZsDpfb5ENJXtLrZ","Northern Steel","2017-12-06","1","2","550124","false","46","spotify:user:sebastianelisapfeifer","2019-09-02T11:50:27Z"
"spotify:track:3Pu5A9oya3ga6scRBINXZV","Carrying You: Chopin Version (From ""Laputa: Castle in the Sky"") [For Piano Solo]","spotify:artist:7nzSoJISlVJsn7O0yTeMOB, spotify:artist:4lQ0kWtfyghMHZmFRYOm08, spotify:artist:6dOnTTVTbQlFWF6yfD4Vw5","Joe Hisaishi, Hayao Miyazaki, daigoro789","spotify:album:2Z3YnIWuKK6wIj2rHgxDZV","Studio Ghibli Classics in the Style of Chopin for Piano","2019-03-12","1","6","284586","false","7","spotify:user:sebastianelisapfeifer","2019-09-02T11:50:48Z"
"spotify:track:70nfm7IEXnFdxLtvxdXnZq","Peer Gynt Suite No. 1, Op. 46: Morning Mood - Arr. for Piano","spotify:artist:5ihY290YPGc3aY2xTyx7Gy, spotify:artist:6mWZj1Lhb9V1ZbYL5UaZ4v","Edvard Grieg, Cyprien Katsaris","spotify:album:5oxH8IwrnqlG5t4nDngDV1","111 Piano Hits - Vol. 5 (World Premiere Recordings)","2014-11-15","1","14","233106","false","58","spotify:user:sebastianelisapfeifer","2020-01-08T21:07:21Z"
"spotify:track:6oWeXnGXH2h1Ai0nw8NvCJ","Peer Gynt Suite No. 1, Op. 46: IV. In the Hall of the Mountain King","spotify:artist:5ihY290YPGc3aY2xTyx7Gy, spotify:artist:1Q9HCWdqbiui9pOsDtYkXW, spotify:artist:11vpC3XmFb1LIP2ugl96lZ","Edvard Grieg, Andrew Davis, New Philharmonia Orchestra","spotify:album:6OliB6VRtg4tD2TI2iFBto","Grieg: Orchestral Music","1968","1","4","145200","false","37","spotify:user:sebastianelisapfeifer","2020-01-08T21:07:49Z"
"spotify:track:4LDXnOCkx6f7jo23c1zFaV","Prophecy","spotify:artist:6qDQ6rJG5TOT7PppxBKhqI","Adrian Von Ziegler","spotify:album:4bc12QynMKKIcmnu4Q2sJr","The Celtic Collection","2012-12-12","1","10","334800","false","48","spotify:user:sebastianelisapfeifer","2020-01-19T15:32:11Z"
"spotify:track:0dErnwCOJio6gkYfzPUfSa","A Celtic Lore","spotify:artist:6qDQ6rJG5TOT7PppxBKhqI","Adrian Von Ziegler","spotify:album:4bc12QynMKKIcmnu4Q2sJr","The Celtic Collection","2012-12-12","1","2","199941","false","47","spotify:user:sebastianelisapfeifer","2020-01-19T15:32:11Z"
"spotify:track:53ZtYTszCIJxCAEdy03xGc","Wolf Blood","spotify:artist:6qDQ6rJG5TOT7PppxBKhqI","Adrian Von Ziegler","spotify:album:2npo1IukKHOMO0eGkLui7Q","Feather and Skull","2013-05-05","1","4","185815","false","44","spotify:user:sebastianelisapfeifer","2020-01-19T15:32:11Z"
"spotify:track:2jw7rDos3bc6xtgx9ALjCs","Moonsong","spotify:artist:6qDQ6rJG5TOT7PppxBKhqI","Adrian Von Ziegler","spotify:album:2dKfOsY1IqAuQAgBdTHP9Z","Moonsong","2016-12-12","1","3","216600","false","46","spotify:user:sebastianelisapfeifer","2020-01-19T15:32:11Z"
"spotify:track:1Kx8uz29rpleUDKBm11qGT","Spirits of the Wild","spotify:artist:6qDQ6rJG5TOT7PppxBKhqI","Adrian Von Ziegler","spotify:album:4bc12QynMKKIcmnu4Q2sJr","The Celtic Collection","2012-12-12","1","5","155881","false","43","spotify:user:sebastianelisapfeifer","2020-01-19T15:32:11Z"
"spotify:track:5VaFobgRSIhIQLOJOb5Htw","Tubular Bells - Pt. I","spotify:artist:562Od3CffWedyz2BbeYWVn","Mike Oldfield","spotify:album:6DCKvIzj7NnAwmdtI010JY","The Mike Oldfield Collection","2009-01-01","1","1","1561133","false","31","spotify:user:sebastianelisapfeifer","2020-01-21T22:51:25Z"
"spotify:track:7aWkrONpnjiANaAfE1lZd2","In The Hall Of The Mountain King","spotify:artist:5ihY290YPGc3aY2xTyx7Gy","Edvard Grieg","spotify:album:3Bj5cCoRjw0b2p8yE9nEHe","A Calendar Of Classics - A 12 CD Set Of Romantic Classics For Every Month Of The Year","2007-10-01","4","2","166933","false","0","spotify:user:sebastianelisapfeifer","2020-01-23T21:53:13Z"
"spotify:track:4Nd5HJn4EExnLmHtClk4QV","Ode to Joy","spotify:artist:2wOqMjp9TyABvtHdOSOTUS","Ludwig van Beethoven","spotify:album:1SkmA5emGHKMJva7baN4lq","Classical Best Of","2009-03-01","1","23","656800","false","43","spotify:user:sebastianelisapfeifer","2020-01-23T21:53:30Z"
"spotify:track:0ZN01wuIdn4iT8VBggkOMm","Symphony No. 5 In C Minor Part 1","spotify:artist:2wOqMjp9TyABvtHdOSOTUS","Ludwig van Beethoven","spotify:album:1SkmA5emGHKMJva7baN4lq","Classical Best Of","2009-03-01","1","2","485293","false","45","spotify:user:sebastianelisapfeifer","2020-01-23T21:54:19Z"
"spotify:track:3yNGyBSpZb6Ua8r2x6TwdD","Williams: The Throne Room - End Title [Star Wars - Main Theme]","spotify:artist:3dRfiJ2650SZu6GbydcHNb, spotify:artist:4CT3l7DatMvKA6WSejee4S, spotify:artist:0aBCjuDMg4Bh7SU0ayu4ov","John Williams, Hollywood Bowl Orchestra, John Mauceri","spotify:album:6YffFzDclLJoaHMD7NX5Uj","John Williams - Star Wars and Beyond","2016-06-03","1","10","463626","false","13","spotify:user:sebastianelisapfeifer","2020-02-13T14:03:42Z"
